id,title,description,price,count
"6a769bc4-1b8c-4b2a-82fb-81e36b3e71f7","Crochet Dragon Doll","Adorable amigurumi dragon doll perfect for fantasy playtime.",19.99,50
"3f7c2e7d-10da-4859-8e84-018f95a04f42","Amigurumi Unicorn Doll","Magical unicorn amigurumi doll with colorful mane and horn.",22.99,40
"ff0f1b5d-2a1d-43cb-aa3e-16ed2dd09de3","Crochet Phoenix Doll","Fiery phoenix amigurumi doll with vibrant feathers.",24.99,30
"b3fb5a6f-ee86-4f3e-ae52-3a228f5c44fd","Amigurumi Griffin Doll","Majestic griffin amigurumi doll with lion body and eagle wings.",26.99,35
"1a9e5888-1e1d-40fc-9ebf-04a7d1fd2f12","Crochet Pegasus Doll","Gentle pegasus amigurumi doll with wings and flowing mane.",23.99,25
"dc45bce2-1b78-4434-9035-7c7ef1a99412","Amigurumi Phoenix Dragon Doll","Mystical creature amigurumi doll combining features of phoenix and dragon.",28.99,45
"4e5b6ec0-4c5e-4b8c-b9d4-189e3949db0e","Crochet Fairy Cat Doll","Enchanting fairy cat amigurumi doll with wings and tail.",21.99,55
